{
  "$schema": "http://json-schema.org/draft-07/schema#",
  "type": "object",
  "properties": {
    "version": { "type": "string" },
    "nodes": {
      "type": "array",
      "items": {
        "type": "object",
        "properties": {
          "id": { "type": "string", "pattern": "^[a-zA-Z0-9_-]+$" },
          "label": { "type": "string", "minLength": 1 },
          "type": {
            "type": "string",
            "enum": ["fetch", "http", "command", "query", "render", "agent", "group"]
          },
          "uri": { "type": "string", "format": "uri" },
          "method": { "type": "string", "enum": ["GET", "POST", "PUT", "DELETE"] },
          "url": { "type": "string", "format": "uri" },
          "headers": {
            "type": "object",
            "propertyNames": { "type": "string" },
            "additionalProperties": { "type": "string" }
          },
          "command_type": { "type": "string" },
          "input": { "type": "string" },
          "inputs": {
            "type": "array",
            "items": { "type": "string" }
          },
          "schema_uri": { "type": "string", "format": "uri" },
          "mime_type": { "type": "string" },
          "description": { "type": "string" },
          "role": { "type": "string" },
          "goal": { "type": "string" },
          "tools": {
            "type": "array",
            "items": { "type": "string" }
          },
          "memory_uri": { "type": "string", "format": "uri" }
        },
        "required": ["id", "type"]
      }
    },
    "outputs": {
      "type": "array",
      "items": {
        "type": "object",
        "properties": {
          "id": { "type": "string" },
          "label": { "type": "string" },
          "source": { "type": "string" },
          "description": { "type": "string" }
        },
        "required": ["id", "source"]
      }
    },
    "ui": {
      "type": "object",
      "properties": {
        "layout": {
          "type": "string",
          "enum": ["LR", "TB"]
        }
      }
    }
  },
  "required": ["version", "nodes"]
}
